{
  "$schema": "https://json-schema.org/draft/2020-12/schema",
  "$id": "https://vibedeck-schema.alanreisanjo.workers.dev/v1/idea.schema.json",
  "title": "VibeDeck idea",
  "description": "A future idea for the project, with draft rules (not enforced until promoted). Lives at <repo>/.vibedeck/ideas/<slug>.json.",
  "type": "object",
  "required": ["id", "title", "status", "rules", "author", "createdAt", "updatedAt"],
  "properties": {
    "$schema": { "type": "string" },
    "id": { "type": "string", "format": "uuid" },
    "title": { "type": "string", "minLength": 1 },
    "body": { "type": "string", "description": "Markdown." },
    "status": { "enum": ["new", "exploring", "approved", "discarded", "done"] },
    "tags": { "type": "array", "items": { "type": "string" } },
    "paths": { "type": "array", "items": { "type": "string" }, "description": "Suggested globs (relative to the repo root). Promotion copies them into the topic's paths." },
    "rules": { "type": "array", "items": { "$ref": "rule-topic.schema.json#/$defs/rule" } },
    "promotedTopic": { "type": "string", "description": "Slug of the rule topic created from this idea." },
    "readiness": {
      "type": "object",
      "description": "Last AI verdict on whether the idea is ready to implement. Stale when fingerprint differs from the current content (title, body, paths, rules).",
      "required": ["viable", "checkedAt", "fingerprint"],
      "properties": {
        "viable": { "type": "boolean" },
        "missing": { "type": "array", "items": { "type": "string" }, "description": "Gaps that keep the idea from being implemented." },
        "checkedAt": { "type": "string", "format": "date-time" },
        "fingerprint": { "type": "string" }
      },
      "additionalProperties": false
    },
    "dependencies": {
      "type": "array",
      "description": "UUIDs of other ideas of the same project that must be done before this one can be implemented. Dependents are derived, never stored.",
      "items": { "type": "string", "format": "uuid", "pattern": "^[0-9A-Fa-f]{8}-[0-9A-Fa-f]{4}-[0-9A-Fa-f]{4}-[0-9A-Fa-f]{4}-[0-9A-Fa-f]{12}$" },
      "uniqueItems": true
    },
    "author": { "enum": ["human", "ai"] },
    "createdAt": { "type": "string", "format": "date-time" },
    "updatedAt": { "type": "string", "format": "date-time" }
  },
  "additionalProperties": false
}
