{
  "$schema" : "https://vibedeck-schema.alanreisanjo.workers.dev/v1/idea.schema.json",
  "author" : "ai",
  "body" : "Análise estática do código (sem medição com Instruments). Nada grave hoje, mas há pontos que pioram conforme projetos e históricos crescem.\n\n## Pontos de atenção (do mais provável ao menos provável)\n\n1. **AIUsageHistoryView.swift:39-45**: a cada 3 s, com a janela aberta, `AIUsageStore.list()` lê e decodifica todos os JSONs de uso na thread principal. Cresce sem limite com o histórico.\n2. **ProjectModel.swift:327 / ProjectStore.swift:1398**: `listChecks()` relê e decodifica todos os checks a cada mudança em `/checks/` (hoje 174 arquivos, 2,9 MB). Cada `submit_rule_check` dispara o reload completo. O mesmo padrão vale para `listRuns` e `listDocs`.\n3. **ProjectModel.swift:244**: `handleExternalChanges` lê cada arquivo alterado na thread principal para comparar com `lastWritten`. Rajadas de escrita da IA ou do CLI podem engasgar a UI.\n4. **ClaudeChatPage.swift:128**: `.onChange(of: claude.entries)` compara o array inteiro a cada delta de streaming. Em ClaudeSession.swift:623 o texto do assistente é recriado como `current + text` a cada pedaço. Em conversas longas, custo O(n) por delta.\n5. **Polling com Task.sleep**: uso do Claude a cada 15 s, provider a cada 30 s, diagnóstico a cada 3 s. Custo pequeno, mas `ClaudeUsageView.reload()` roda na thread principal. Conferir se os loops param ao fechar a janela.\n\n## O que já está bem\n- Editor Markdown renderiza só o trecho alterado (há teste).\n- FileWatcher via FSEvents, ignorando as escritas do próprio app.\n- `reload*` só atribuem o estado se a lista mudou.\n- Transcript do chat usa LazyVStack.\n- Grafo e diagnóstico carregam fora da thread principal.\n\n## Plano\n- Mover `AIUsageStore.list()` e `listChecks()` para `Task.detached`, como o diagnóstico já faz.\n- Trocar o polling de 3 s por reload disparado pelo FileWatcher, ou pular o reload quando a contagem e a data de modificação da pasta não mudaram.\n- Carregar só a primeira página (por exemplo, os 50 mais recentes) do histórico de uso e dos checks.\n- Trocar `onChange(of: entries)` por `entries.count` ou pelo id e tamanho da última entrada.\n- Antes de mexer, medir com Instruments (Time Profiler) para confirmar os pontos acima.",
  "createdAt" : "2026-10-12T03:20:13Z",
  "id" : "C17132D2-9CAA-4981-A4B5-81CBE4550AA8",
  "rules" : [

  ],
  "status" : "new",
  "tags" : [
    "performance",
    "pós-reescrita"
  ],
  "title" : "Melhorar a performance do app após a reescrita",
  "updatedAt" : "2026-10-12T03:20:13Z"
}
