{
  "$schema" : "https://vibedeck-schema.alanreisanjo.workers.dev/v1/idea.schema.json",
  "author" : "human",
  "body" : "## Problema\n\nHoje o usuário escreve à mão os globs, as tags e as regras de um tópico de regras ou de uma ideia. Falta ajuda da IA para descobrir o escopo (globs e tags) e para levantar regras boas fazendo perguntas ao usuário. Isso vale para tópicos e para ideias.\n\n## Proposta\n\nUm único botão **Descubra**, com o mesmo componente, no editor do tópico de regras (`Sources/VibeDeckApp/RulesView.swift`) e no da ideia (`Sources/VibeDeckApp/IdeaView.swift`). O fluxo é sob demanda, no mesmo botão:\n\n1. **Escopo.** A IA propõe `paths` (globs) e `tags`, cada um com justificativa curta (arquivo:linha ou regra existente).\n2. **Entrevista.** Um painel próprio mostra perguntas estruturadas. A IA devolve JSON com perguntas e opções de resposta, e o app mostra um formulário em rodadas curtas. Há limite de perguntas por rodada (`RuleDiscover.maxQuestions`) e de rodadas (`maxRounds`), e um botão \"gerar com o que já tenho\".\n3. **Regras.** A IA gera as regras como rascunho, cada uma com severidade (must/should), atômica e verificável. Duplicatas e conflitos com regras existentes são sinalizados.\n\n**Contexto enviado à IA:** título, descrição, globs e tags atuais, vocabulário de tags existente e os tópicos/regras existentes. A IA lê o repositório só com Read/Grep/Glob.\n\n**Destino, sem gravar direto:**\n- Em ideias, as regras aceitas entram em `idea.rules` como rascunho, e os globs aceitos ficam em `idea.paths`.\n- Em tópicos, aparecem como proposta e só viram regras ao aceitar.\n- Cada aceite é um único passo de undo.\n\n**Globs na ideia.** A ideia ganha o campo opcional `paths` (`schema/v1/idea.schema.json`, espelhado em `worker/public/v1/idea.schema.json`).\n- Na promoção (`ProjectStore.promoteIdea`), o tópico novo nasce com esses `paths`.\n- Se a ideia já tem tópico, os globs dela são somados aos do tópico, sem remover nenhum.\n- Globs que não casam mais nenhum arquivo são avisados ao usuário (`unmatchedIdeaPaths`) em vez de copiados em silêncio.\n\n**Segurança e robustez:**\n- A chamada ao Claude roda só com ferramentas de leitura, sem Edit/Write/Bash.\n- A resposta é JSON validado. Se o parse falhar, mostra erro claro e não altera nada.\n- Globs precisam casar ao menos um arquivo existente e não podem ser catch-all (`*`, `**`, `**/*`).\n- Tags vêm do vocabulário existente. Tag nova só entra com aceite explícito.\n- Globs e tags só são adicionados, nunca removidos ou sobrescritos sem aceite.\n- Há cancelar e timeout, e a resposta é descartada se o item mudou ou deixou de estar selecionado durante a chamada.\n\n## Escopo\n\n- `Sources/VibeDeckCore/RuleDiscover.swift`: prompts, schemas JSON, validação e `RuleDiscoverScope` / `RuleDiscoverDrafts`.\n- `Sources/VibeDeckCore/Rules.swift`: `Idea.paths`.\n- `Sources/VibeDeckCore/ProjectStore.swift`: `promoteIdea` e `unmatchedIdeaPaths`.\n- `Sources/VibeDeckApp/RuleDiscover.swift`, `RulesView.swift`, `IdeaView.swift`, `ProjectModel.swift`: UI, painel de entrevista e integração com undo.\n- `schema/v1/idea.schema.json` e `worker/public/v1/idea.schema.json`.\n- `README.md` e o guia (`.vibedeck/guide.md`), se a documentação mudar.\n- Testes em `Tests/`: validação de globs/tags, promoção com soma de paths e parse da resposta.\n- Fora de escopo: expor por MCP/CLI e marcar autoria por campo.\n\n## Critérios de aceite\n\n- O botão Descubra aparece no tópico e na ideia, e só quando há provedor de IA suportado.\n- Nada é gravado sem aceite. Cada aceite é um passo de undo.\n- Globs catch-all ou sem arquivo correspondente são descartados antes da proposta.\n- Tags novas começam desmarcadas.\n- A entrevista respeita os limites de perguntas e de rodadas e permite parar e gerar.\n- Regras duplicadas ou conflitantes aparecem sinalizadas.\n- Promover uma ideia copia `idea.paths` para o tópico novo, ou soma aos paths do tópico existente. Globs obsoletos geram aviso.\n- Cancelar, timeout e descarte de resposta obsoleta funcionam.\n- `swift test` passa e o schema é atualizado.",
  "createdAt" : "2026-10-09T03:25:51Z",
  "id" : "0D332B0B-98FC-4D41-982D-F522CC36E501",
  "paths" : [
    "schema/v1/idea.schema.json",
    "worker/public/v1/idea.schema.json"
  ],
  "readiness" : {
    "checkedAt" : "2026-10-09T18:48:47Z",
    "fingerprint" : "1af0104b57dfe74b",
    "viable" : true
  },
  "rules" : [
    {
      "author" : "ai",
      "createdAt" : "2026-10-09T14:52:18Z",
      "id" : "F3E9484E-53EA-44BB-A3B4-87B3040E4BEC",
      "severity" : "must",
      "text" : "O Descubra das regras nunca grava direto: mostra uma proposta (atual → sugerido) e o usuário aceita tudo ou por item; cada aceite é um único passo de undo."
    },
    {
      "author" : "ai",
      "createdAt" : "2026-10-09T14:52:18Z",
      "id" : "80C236FE-674B-4613-A937-FB1422629E22",
      "severity" : "must",
      "text" : "A chamada ao Claude roda só com ferramentas de leitura (Read/Grep/Glob), sem Edit/Write/Bash."
    },
    {
      "author" : "ai",
      "createdAt" : "2026-10-09T14:52:18Z",
      "id" : "779E0132-897E-432C-8033-6DB13C89EDF6",
      "severity" : "must",
      "text" : "A resposta do Claude é JSON validado; se o parse falhar, mostra erro claro e não altera nada."
    },
    {
      "author" : "ai",
      "createdAt" : "2026-10-09T14:52:18Z",
      "id" : "4A586270-00BA-44D8-9159-70D581B11A92",
      "severity" : "must",
      "text" : "Globs sugeridos precisam casar ao menos um arquivo existente e não podem ser catch-all (`**`, `*`, `**/*`)."
    },
    {
      "author" : "ai",
      "createdAt" : "2026-10-09T14:52:18Z",
      "id" : "B59A36C1-8F3C-48C1-B291-ADC251C9943F",
      "severity" : "must",
      "text" : "Tags sugeridas vêm do vocabulário existente; tag nova só entra com aceite explícito."
    },
    {
      "author" : "ai",
      "createdAt" : "2026-10-09T14:52:18Z",
      "id" : "53449BEB-40E8-478E-B810-FEC1579F4966",
      "severity" : "must",
      "text" : "Globs e tags só são adicionados, nunca removidos ou sobrescritos sem aceite explícito."
    },
    {
      "author" : "ai",
      "createdAt" : "2026-10-09T14:52:18Z",
      "id" : "EEC021E0-538C-489A-B7E2-469B12E6E597",
      "severity" : "must",
      "text" : "Regras geradas vêm como rascunho com severidade (must/should): em ideias vão para idea.rules; em tópicos só viram regras ativas após aceite."
    },
    {
      "author" : "ai",
      "createdAt" : "2026-10-09T14:52:18Z",
      "id" : "331249BB-38FD-429C-8714-1E689059B6FD",
      "severity" : "must",
      "text" : "A entrevista tem limite de perguntas por rodada e permite parar e gerar com o que já foi respondido."
    },
    {
      "author" : "ai",
      "createdAt" : "2026-10-09T14:52:18Z",
      "id" : "3EC4C2CA-D633-482F-9B22-D8932BD07B0B",
      "severity" : "should",
      "text" : "Cada sugestão vem com justificativa curta (arquivo:linha ou regra existente que a motivou)."
    },
    {
      "author" : "ai",
      "createdAt" : "2026-10-09T14:52:18Z",
      "id" : "74C84D3C-4834-408A-96C0-F49D26C6D486",
      "severity" : "should",
      "text" : "Regras que duplicam ou conflitam com as existentes são sinalizadas na proposta."
    },
    {
      "author" : "ai",
      "createdAt" : "2026-10-09T14:52:18Z",
      "id" : "5119C311-3CBD-47D7-B779-74F96730D6EB",
      "severity" : "should",
      "text" : "Há cancelar e timeout, e a resposta é descartada se o item mudou ou deixou de estar selecionado durante a chamada."
    },
    {
      "author" : "ai",
      "createdAt" : "2026-10-09T14:52:18Z",
      "id" : "48639695-AAF3-4735-AFDC-728FC1E8D23F",
      "severity" : "should",
      "text" : "Cada regra gerada é atômica e verificável (um comportamento por regra)."
    },
    {
      "author" : "ai",
      "createdAt" : "2026-10-09T14:55:58Z",
      "id" : "29057318-0B3D-4B45-BE16-97FB4C43F831",
      "severity" : "must",
      "text" : "Globs aceitos numa ideia ficam guardados em idea.paths e, na promoção, viram os paths do tópico; se o tópico já existe, são somados sem remover os atuais."
    },
    {
      "author" : "ai",
      "createdAt" : "2026-10-09T14:55:58Z",
      "id" : "42470BFE-510E-41C3-8C53-E5539669A5FA",
      "severity" : "should",
      "text" : "Na promoção, globs da ideia que não casam mais nenhum arquivo são avisados ao usuário em vez de copiados em silêncio."
    }
  ],
  "status" : "done",
  "tags" : [
    "ideias",
    "regras",
    "ia",
    "schema",
    "swiftui",
    "core"
  ],
  "title" : "Botão de Descubra nas regras",
  "updatedAt" : "2026-10-09T18:49:40Z"
}
