{
  "$schema" : "https://vibedeck-schema.alanreisanjo.workers.dev/v1/idea.schema.json",
  "author" : "human",
  "body" : "A ideia é que tenham dois botões em cada item de revisão ou ideia(Você também pode selecionar mais de uma):\n- Gerar Prompt:\n\tCom base nas informações que já existem, deverá ser gerado um prompt, que além de ser exibido para o usuário, deverá ser possível copiar o prompt para ficar na área de transferência\n- Enviar para Workflow:\n\tVocê poderá enviar esse grande conjunto de informações para um workflow, e ele vai criar o ",
  "createdAt" : "2026-10-08T04:13:39Z",
  "id" : "E908C846-E61D-4130-9D39-CA8847261690",
  "rules" : [

  ],
  "status" : "new",
  "title" : "Botão de gerar prompt e enviar para workflow sobre Ideias e Revisões",
  "updatedAt" : "2026-10-08T04:36:36Z"
}
