{
  "$schema" : "https://vibedeck-schema.alanreisanjo.workers.dev/v1/idea.schema.json",
  "author" : "human",
  "createdAt" : "2026-10-08T08:25:00Z",
  "id" : "1E326964-BAA3-4D5E-B4C6-EFE6D11C5435",
  "rules" : [

  ],
  "status" : "new",
  "title" : "Será que a IA consegue validar um json schema com um json?",
  "updatedAt" : "2026-10-08T08:25:00Z"
}
